headline,date,url,description
Thai evacuees hope for end to fighting as Cambodia conflict enters fourth day,7/27/2025,https://apnews.com/video/thai-evacuees-hope-for-end-to-fighting-as-cambodia-conflict-enters-fourth-day-f93d1d2d222145faa6cb5f2281493dd0,Evacuation centers in Thailand near the Cambodian border continue to house masses of civilians who have fled the armed conflict.
Desperate Palestinians willing to risk life in attempt to secure food aid for their families,7/27/2025,https://apnews.com/video/desperate-palestinians-willing-to-risk-life-in-attempt-to-secure-food-aid-for-their-families-0ca48aa8bccf4a579f9837c7fe6e54f4,Hundreds of weary Palestinians carried sacks of flour on their shoulders after they managed to fetch them from a truck envoy that entered Gaza.
Israel again intercepts Gaza-bound ship carrying activists and humanitarian aid,7/27/2025,https://apnews.com/article/gaza-blockade-activist-ship-seized-24c32eafd80d08a63e5bed8b83d5972f,"The Israeli military has intercepted a Gaza-bound aid ship, detaining 21 international activists and journalists and seizing all cargo, including baby formula, food, and medicine, according to the Freedom Flotilla Coalition."
"In Syria’s Sweida, the stench of death still lingers days after sectarian bloodshed",7/27/2025,https://apnews.com/article/syria-sweida-sectarianism-ahmad-alsharaa-druze-fighting-e1cec070de22805a492c9151c0ec6fd1,"In the aftermath of intense sectarian fighting, the eerily silent streets of Syria’s southern province of Sweida are filled with the stench of decaying bodies left uncollected for days amid scenes of charred buildings and burned-out cars."
"Death, fear, and despair enclose Syrian provincial capital of Sweida after fierce fighting",7/27/2025,https://apnews.com/video/death-fear-and-despair-enclose-syrian-provincial-capital-of-sweida-after-fierce-fighting-49284ce680b848ce867cabfc688e2f80,"The stench of decaying bodies hangs heavy in the streets of the provincial capital in Syria’s southern province of Sweida, where fighting recently erupted."
Intercepted ship carrying activists and humanitarian aid for Gaza arrives at Israel port,7/27/2025,https://apnews.com/video/intercepted-ship-carrying-activists-and-humanitarian-aid-for-gaza-arrives-at-israel-port-e1c7063783534ed68d33608ec037577b,"An aid ship intercepted by the Israeli military sailed towards the port of Ashdod on Sunday, accompanied by an Israeli navy vessel. (AP Video/Moshe Edri)"
Desperate Palestinians jostle for food at charity kitchen,7/27/2025,https://apnews.com/video/desperate-palestinians-jostle-for-food-at-charity-kitchen-f624fc23a8db45109f06bd3d57f45e73,"Dozens of Palestinians, mostly women and children, gathered around a charity kitchen in Gaza City, carrying their pots hoping to get food for themselves and their families."
Landlord imprisoned for decades in hate-crime attack on Palestinian American family has died,7/27/2025,https://apnews.com/article/palestinian-hate-crime-chicago-joseph-czuba-88344cd3643902ee2938366e7f190d81,A landlord who was sentenced to decades in prison for killing a Palestinian American boy and wounding his mother has died.
"Cambodia-Thailand conflict: Monks, dancers and volunteers offer respite as violence escalates",7/27/2025,https://apnews.com/video/cambodia-thailand-conflict-monks-dancers-and-volunteers-offer-respite-as-violence-escalates-60272697a5c14c408a7d4c946360fb3f,"Long-festering tensions over border territory have escalated into armed conflict between Cambodia and Thailand, leading to dozens of deaths on both sides and displacing tens of thousands of people."
"Cambodia-Thailand conflict: Monks, dancers and volunteers offer respite as violence escalates",7/27/2025,https://apnews.com/article/cambodia-thailand-monks-volunteers-donations-d92b0dfee396e6004585456d7d2b8270,"Long-festering tensions over border territory have escalated into armed conflict between Cambodia and Thailand, leading to dozens of deaths on both sides and displacing tens of thousands of people."
